{"artifacts":[{"digest":"sha256:aaaaaaaaaaaaaaaaaaaaaaaaaaaaaaaaaaaaaaaaaaaaaaaaaaaaaaaaaaaaaaaa","media_type":"application/json","name":"results"}],"assertions":[{"id":"contract","reason":null,"status":"pass"}],"candidate":{"dirty":false,"git_commit":"1111111111111111111111111111111111111111","git_tree":"2222222222222222222222222222222222222222","identity_digest":"sha256:abfb89ff89c54b096381e6b37d7d19fe1f582e14dfd34a3fa8cdd3ba1cb0a6ff","package_version":"0.3.10","source_tree_digest":"sha256:eeeeeeeeeeeeeeeeeeeeeeeeeeeeeeeeeeeeeeeeeeeeeeeeeeeeeeeeeeeeeeee"},"environment":{"architecture":"x86_64","isolation_profile":"sha256:bbbbbbbbbbbbbbbbbbbbbbbbbbbbbbbbbbbbbbbbbbbbbbbbbbbbbbbbbbbbbbbb","os":"linux","python":"3.12.0","runner_image":"sha256:cccccccccccccccccccccccccccccccccccccccccccccccccccccccccccccccc"},"finished_at":"2026-08-14T10:00:01Z","gate_id":"B-SCHEMA","inputs":[],"lane":"H0-hermetic","not_applicable_rule":null,"reason":null,"release":"0.3.10","required":true,"schema_version":"quarry.release-gate.v1","selection":{"collected":1,"deselected":0,"failed":0,"passed":1,"selected":1,"skipped":0,"xfailed":0,"xpassed":0},"signature":null,"started_at":"2026-08-14T10:00:00Z","status":"pass","toolchain":[{"digest":"sha256:dddddddddddddddddddddddddddddddddddddddddddddddddddddddddddddddd","name":"pytest","path":"/runner/bin/pytest","version":"8.3.5"}]}
